{
  "$schema": "http://json-schema.org/draft-07/schema#",
  "title": "ProtSpace Data Schema",
  "type": "object",
  "properties": {
    "feature_keys": {
      "type": "array",
      "items": { "type": "string" }
    },
    "feature_values": {
      "type": "object",
      "patternProperties": {
        "^[a-zA-Z0-9_]+$": {
          "type": "array",
          "items": { "type": "string" }
        }
      },
      "additionalProperties": false
    },
    "protein_data": {
      "type": "object",
      "patternProperties": {
        "^[a-zA-Z0-9_]+$": {
          "type": "array",
          "items": {
            "type": ["number", "null"]
          }
        }
      },
      "additionalProperties": false
    },
    "projections": {
      "type": "array",
      "items": {
        "type": "object",
        "properties": {
          "name": { "type": "string" },
          "dimensions": { "type": "integer" },
          "protein_ids": {
            "type": "array",
            "items": { "type": "string" }
          },
          "coordinates": {
            "type": "array",
            "items": {
              "type": "array",
              "items": { "type": "number" }
            }
          }
        },
        "required": ["name", "dimensions", "protein_ids", "coordinates"],
        "additionalProperties": false
      }
    },
    "visualization_state": {
      "type": "object",
      "properties": {
        "styles": {
          "type": "object",
          "patternProperties": {
            "^[a-zA-Z0-9_]+$": {
              "type": "object",
              "additionalProperties": {
                "type": "object",
                "properties": {
                  "color": { "type": "string" },
                  "marker": { "type": "string" }
                },
                "required": ["color", "marker"],
                "additionalProperties": false
              }
            }
          },
          "additionalProperties": false
        }
      },
      "additionalProperties": false
    }
  },
  "required": ["feature_keys", "feature_values", "protein_data", "projections"],
  "additionalProperties": false
}
